لغة ترميز النص الفائق,لغة ترميز النص التشعبي ( بالإنجليزية : HyperText Markup Language ) ( إختصار إتش تي إم إل HTML ) ،
هاكتفيزم,هاكتفيزم ( بالإنجليزية : hacktivism ) هو استخدام أجهزة الحاسوب والشبكات الحاسوبية لتعزيز أجندة سياسية . وغالبا ما ترتبط أهدافه
أداة كتابة المساعدات ( هات ),أداة كتابة الإرشادات برنامج حاسوبي يستعمل لكتابة محتوى الإرشادات ( قسم المساعدة ) في البرامج المتصلة بالإنترنت .
تقنية عالية,التقنية العالية ( بالإنجليزية : High Tech هاي تيك، اختصارا لـ High Technology ) هي التقنية المتواجدة في الوضع الأكثر
تاريخ الألومنيوم,تاريخ الألومنيوم ( بالإنجليزية : History of aluminium ) يعتبر الألومنيوم عنصرًا كيميائيًا يحمل الرمز ( Al ) ورقمه الذري
تاريخ التقانة الحيوية,== قبل الميلاد ==
تاريخ صناعة الشموع,تطورت صناعة الشموع بشكل مستقل في العديد من الأماكن على مر التاريخ . استخدمت الشموع من قِبَل اليونانيون القدامى تكريماً
تاريخ الواقي الذكري,تاريخ الواقي الذكري يعود على الأقل عدة قرون، وربما بعده . بالنسبة لمعظم تاريخهم، وقد استخدمت الواقي الذكري على حد
تأريخ تقنية النانو,تأريخ تقنية النانو على الرغم من أن تقنية النانو ظهرت حديثا نسبيا كتقنية في مجال البحث العلمي، فأن تطوير المفاهيم
تاريخ الورق,المخطوطات الورقية عبر العصور : كل الناس يعلمون ما يؤديه الورق من خدمات في ميادين : الكتابة والطباعة ولف البضائع
تاريخ الصواريخ,وقد وضعت الصواريخ التي تعمل بطاقة البارود الأولى في عهد أسرة سونغ في الصين في القرن ال13 . وانتشرت في
تاريخ العلوم والتكنولوجيا,تاريخ العلوم والتكنولوجيا على ( HST ) هو حقل من التاريخ الذي يدرس كيفية فهم البشرية للعالم الطبيعي ( العلم
تاريخ التكنولوجيا,تاريخ التكنولوجيا هو تاريخ اختراع الأدوات والتقنيات، وهو يشبه بعدة طرق تاريخ الإنسانية . وقد مكنت المعرفة التقنية الناس من
تاريخ محرك الاحتراق الداخلي,ساهم العديد من العلماء والمهندسين في تطوير محركات الاحتراق الداخلي . طور جون بربر تربينة في عام 1791 . سجل
تاريخ التلسكوب,ظهر أول تلسكوب معروف عام 1608 في هولندا عندما حاول صانع النظارات هانز ليبرشي الحصول على براءة الاختراع على واحد
تاريخ آلات قياس الوقت,عبر آلاف السنين، استخدمت العديد من الآلات لقياس وتتبع الوقت . واعتمد الإنسان على النظام الستيني لقياس الوقت منذ نحو
تاريخ أجهزة ضبط الوقت في مصر,كان المصريون القدماء من أوائل الثقافات التي تقسم الأيام إلى أجزاء متساوية متفق عليها بشكل عام، وذلك باستخدام أجهزة ضبط
كيفية,الكيفية هي وصف لطريقة عمل شيء أو صنعه أو توضيح لمسألة، يقدمه ذوو الاختصاص للعامة من قليلي الخبرة والهواة .
آي فون ( الجيل الأول ),أي فون ( بالإنجليزية : iPhone ) هو أول هاتف ذكي صمم و صنع من قبل شركة أبل يعمل بنظام
سرعة الحمل الخالي,سرعة الحمل الخالي ( بالأنكليزية : Engine idle speed ) هي السرعة الدورانية للمحرك عند عدم التحميل أي عند عدم
الثورة الصناعية,الثورة الصناعية هي انتشار وإحلال العمل اليدوي بالمكننة . شهدت بلدان أوروبا الغربية خلال القرن الثامن عشر نهضة علمية شاملة
نظام الملاحة بالقصور الذاتي,نظام الملاحة بالقصور الذاتي ( INS ) عبارة عن وسيلة مساعدة للملاحة تستخدم الحاسوب وأجهزة استشعار الحركة ( مقاييس التسارع
الحصول على المعلومات,الحصول على المعلومات ( بالإنجليزية : Information access ) هي أحد النظم الفرعية في نظام المعلومات وظيفته الأساسية هي اختزان
عمارة المعلومات,هندسة المعلومات أو عمارة المعلومات هي فن التعبير عن نموذج أو مفهوم للمعلومات المستخدمة في الأنشطة التي تتطلب تفاصيل واضحة
تقنية المعلومات,تقنية المعلومات أو تكنولوجيا المعلومات وتختصر إلى IT وحسب تعريف ( مجموعة تقنية المعلومات الأمريكية ) ITAA، هي `` دراسة،
بنية تحتية,البنية التحتية هي الهياكل التنظمية اللازمة لتشغيل المجتمع أو المشروع أو الخدمات والمرافق اللازمة لكي يعمل الاقتصاد . ويمكن تعريفها
زحف التعليمات,تحدث عملية زحف التعليمات عندما تزداد التعليمات في العدد والحجم بمرور الوقت حتى يصعب السيطرة عليها . ومن الممكن أن
المنظمة الدولية للمعايير,المنظمة الدولية للمعايير ( أيزو ) ( بالإنجليزية : International Organization for Standardization ) ( بالفرنسية : Organisation internationale de
الجمعية الدولية للتكنولوجيا في التعليم,`` الجمعية الدولية '' للتكنولوجيا في التعليم ( إيست ) هي منظمة غير ربحية مهنية التي تضم في عضويتها زعماء
توطين وعولمة ( معلوماتية ),التدويل والتطويع المحلي هما الآلياتان المستخدمتان، في مجال الحوسبة، في تهيئة برامج الكمبيوتر لتتسع للغات المختلفة والاختلافات الناجمة باختلاف المناطق
إنتربرس,إنتربرس ( بالإنجليزية : Interpress ) هي لغة لوصف الصفحات طورت في زيروكس بارك، اعتمادًا على لغة فورث ولغة رسومية
اختراع الهاتف,كان اختراع الهاتف تتويجا للعمل الذي قام به العديد من الأفراد ، وأدى إلى مجموعة من الدعاوى القضائية المتعلقة بمطالبات
منسج جاكارد,منسج جاكارد ( بالإنجليزية : Jacquard loom ) هو منسج ميكانيكي اخترعه جوزيف ماري جاركارد في سنة 1801 م .
جون هولدرن,جون هولدرن ( بالإنجليزية : John Holdren ) ( و . 1944 – م ) هو فيزيائي، وبروفيسور ( أستاذ
قاعدة معرفة,قواعد المعرفة هي نوع من أنواع قواعد البيانات لإدارة المعرفة . قواعد المعرفة هي مخزن للمعلومات التي توفر وسيلة لجمع
فجوة معرفية,الفجوة المعرفية هي الفجوة في المقاييس المعيشية بين من يمكنهم العثور على المعلومات أو المعرفة وتكوينها ومعالجتها ونشرها وبين العاجزين
تطور طويل الأمد ( شبكات إتصالات ),تطور طويل الأمد ( بالإنجليزية : Long Term Evolution ) ويعرف اختصارا ب ( ال تي إي ) ( LTE
قانون قمع الإمكانات المتطورة,قانون قمع الإمكانات المتطورة هو فكرة تم وصفها لأول مرة من قِبل براين وينستون ( Brian Winston ) في كتابه،
لورانس ليسيج,لورانس ليسيج أكاديمي وناشط سياسي أمريكي وصاحب كتاب الثقافة الحرة . عمل أستاذاً للقانون في كلية الحقوق بجامعة ستانفورد كما
شذرة تعلم,شذرة التعلم هو نشاط تعلمي مصغر مدته لا تتجاوز الخمس دقائق يعرض على المتعلم بناء على سياق محدد من اجل
منتجات كانون,== الكاميرات ==
التقنيات التكنولوجية التي نشأت حديثا,تضم القائمة التالية للتقنيات التكنولوجية التي نشأت حديثًا بعضاً من أبرز ما شهدته العلوم والتقنية من تقدم وابتكار في المجالات
قائمة أعلى المطارات,"هذه قائمة بأعلى المطارات المدنية في العالم، والتي تقع على ارتفاعات أعلى من 2,500 م ( 8,202 قدم ) 2500"
قائمة المنابع الضوئية,هذه قائمة بالمنابع الضوئية، تتضمن المنابع الطبيعية والاصطناعية .
قائمة أطول مدارج الطيران,على الرغم من أن طول المدرج قد حاز على الاهتمام الأكاديمي، من حيث قابليتها للاستخدام في خطوط شركات الطيران، فالمدرج
قائمة رموز المراصد الفلكية,هذه قائمة رموز المراصد الفلكية، أو رموز الاتحاد الفلكي الدولي، والمراصد الفلكية المقابلة لها . مركز الكواكب الصغيرة– هو منظَّمة
قائمة أجهزة الاستشعار,قائمة بأجهزة الاستشعار ( المجسات ) مقسمة على حسب النوع والإستخدام .
قائمة المجتمعات الافتراضية التي تحتوي على أكثر من 100 مليون مستخدم نشط,هذه القائمة الحالية تحتوي على أكثر من 100 مليون مستخدم نشط على المجتمعات الإفتراضية . اعتباراً من شهر نوفمبر 2016،
حكومة إلكترونية محلية,الحكومة الإلكترونية المحلية عبارة عن حكومة إلكترونية في علاقتها بـ الحكومة المحلية، وسلطات الشرطة والحرائق والحدائق الوطنية وهيئات النقل .
لاضية,اللاضية ( بالإنجليزية : Luddite ) هي حركه أجتماعية ثورية نشأت في أنجلترا مع بدايات الثورة الصناعية في أوائل القرن
تعلم جوال,التعلم الجوال، التعليم الجوال، أو الموبايل التعليمي هو مصطلح لغوي جديد يشير إلى أستخدام تكنولوجيا المعلومات المتنقلة والأجهزة المحمولة، مثل
لقاح الملاريا,لقاح الملاريا ( بالإنجليزية : Malaria vaccine ) هو لقاح يستخدم لمنع الإصابة بالملاريا . اللقاح الوحيد المعتمد اعتبارًا من
صفحة دليل ( يونكس ),صفحات الدليل هي وثائق تاتي مسبقا مع يونكس، تعرض جميع المعلومات المتعلقة باي أمر ( حوسبة ) تريد مثل (
ضابط تدفق الكتلة,ضابط تدفق الكتلة هو جهاز يُستخدم لقياس وللتحكم في سريان أو تحكم السوائل والغازات . ويتم تصميم هذا الضابط ومعايرته
ثقافة مادية,في العلوم الاجتماعية يشير مصطلح الثقافة المادية الذي ظهر في أواخر القرن التاسع عشر وأوائل القرن العشرين إلى العلاقة بين
سير ميكانيكي,السير الميكانيكي عبارة عن جزء متحرك من آلة، وعادة ما يكون عبارة عن حلقة تنزلق بين المواضع المختلفة على قضيب
وادي ميديكون,وادي ميديكون هو مركز تجمّع علوم الحياة في أوروبا ويمتد على طول منطقة أوريسند في شرق الدنمارك وجنوب السويد .
تحالف وادي ميديكون,يُعد تحالف وادي ميديكون منظمةً تتكون من مجموعة كبيرة من الشركات الدنماركية-السويدية التي تُمثل علوم الحياة البشرية في وادي ميديكون
تكنولوجيا العصور الوسطى,تكنولوجيا العصور الوسطى وتعني التكنولوجيا المستخدمة في أوروبا في عصور وسطى تحت الحكم المسيحي . بعد عصر النهضة في القرن
بيانات وصفية,البيانات الوصفية أو ( بالإنجليزية : MetaData ) هي بيانات رقمية تصف خصائص المصادر الرقمية المتاحة علي شبكة الانترنت، أو
حاسوب دقيق,الحاسوب الدقيق ( بالإنجليزية : Microcomputer ) هو جهاز الكترونى رقمى قابل للبرمجة يتكون من وحدة أساسية هي المعالج الدقيق
تعلم مصغر,يتعامل التعلم المصغر [ بحاجة لمصدر ] مع وحدات ونشاطات تعلم قصيرة المدى . وبوجه عام، يشير تعبير `` التعلم
تقانة ميكروية,التقانة الميكروية ( Microtechnology ) هي تكنولوجيا متخصصة في الأمور من مقياس ميكرومتر ( جزء من مليون من المتر أي
آلة نسخ الرسائل,آلة نسخ الرسائل هي آلة طباعة منخفضة التكلفة تعمل من خلال ضغط الحبر من خلال المرسام على الورق . أستعملت
التبسيطية,( التقليلية أو الحد الأدنى ) ( بالإنجليزية : Minimalism ) وهو أسلوب في الكتابة المهيكلة ابتكرها العالم جون ميلر
وزارة الشؤون الاقتصادية ( هولندا ),وزارة الشئون الإقتصادية ( بالهولندية : Ministerie van Economische Zaken؛ EZ ) هي وزارة هولندية مسئولة عن الإقتصاد، الصناعة، التعدين،
مونبوشو,وزارة التعليم والثقافة والرياضة والعلوم والتقنية ( باليابانية : 文部科学省 مونبوكاغاكوشو ) وتعرف اختصارا بـ MEXT ( مكست ) أو
وزارة التعليم العالي والبحث العلمي ( الإمارات ),هذه قائمة بالوزارات في دولة الإمارات العربية المتحدة
وزارة العلوم,وزارة العلوم أو قسم العلوم هي وزارة أو وكالة حكومية أخرى معنية بالعلوم . وغالبًا ما يرأس الوزارة وزير العلوم
تجارة خلوية,التجارة المحمولة ( بالإنجليزية : M-Commerce ) هو مفهوم مشابه للتجارة الالكترونية من حيث المبدأ، وهو القيام بالأنشطة التجارية مثل
مشغل الهاتف المحمول,مشغل الهاتف المحمول أو مزود الشبكات اللاسلكية هي شركة الهاتف التي تقدم خدمات لمستخدمي الهاتف المحمول . مشغل يعطي بطاقة
مشغل شبكة محمول افتراضية,مشغل شبكة محمول إفتراضية ( بالإنجليزية : MVNO ) هو مقدم لخدمة الاتصالات اللاسلكية المحمولة ولكنه لا يملك ترددات خاصة
بنية نانوية,إن البنية النانوية هي الأغراض ذات الأحجام المتوسطة بين البنى الجزيئية وبين البنى المجهرية ( ذات الحجم الميكرومتري ) عند
الثورة الزراعية,كانت الثورة الزراعية أو التحول الديموغرافي ( السكاني ) في العصر الحجري الحديث، أو الثورة الزراعية، أو الثورة الزراعية الأولى
تأثير الشبكة,"تأثير الشبكة ( بالإنجليزية : Network effect , Network externality ) في مجال التجارة والاقتصاد هي تأثير مستخدم واحد لخدمة"
نوكيا 1,هاتف نوكيا 1 هو هاتف ذكي من صنع شركة نوكيا المملوكة لشركة إتش إم دي العالمية تم الإعلان عن الهاتف
نوكيا لوميا 1320,نوكيا لوميا 1320 ( بالإنجليزية : Nokia Lumia 1320 ) هو هاتف ذكي من نوكيا ضمن سلسلة لوميا يعمل بنظام
هوية مفتوحة للباحثين والمساهمين,الهوية المفتوحة للباحثين والمساهمين ( بالإنجليزية : Open Researcher and Contributor ID؛ تختصر : ORCID ) رمز من حروف وأرقام
نظام دفع فوري,Online Charging System ويرمز اليه أختصارا في اللغة الإنجليزية ب COS. هو عبارة عن نظام يسمح لمقدمي خدمة الاتصالات المتجولة
هندسة عبر الإنترنت,الهندسة عبر الإنترنت ( في بعض الأحيان تسمى الهندسة عن بُعد ) هي اتجاه حالي في الهندسة والعلوم يهدف إلى
أنطولوجية ( علم المعلومات ),الأنطولوجية أو هندسة الأطولوجيات ( علم التوصيف، توصيف المصطلحات ) هي أحد فروع هندسة البرمجيات والمعلوماتية وهي حقل جديد يدرس
الاتحاد المفتوح للهواتف النقالة,التحالف المفتوح للهواتف النقالة ( بالإنجليزية : Open Handset Alliance ) هو تجمع أربعة وثمانون شركة اتصالات ومصنعي المعدات والبرمجيات
معيار مفتوح,معيار مفتوح ( بالإنجليزية : Open Standard ) هو معيار متوفر للجميع كما يرتبط به مجموعة من حقوق الاستخدام وقد
أوبو أف 7,هاتف أوبو أف 7 ( بالإنجليزية : Oppo F7 ) هو فابلت ذكي يعتمد على أندرويد 8.1، والذي تم كشف
مخطط الهندسة المعمارية,المخطط التالي يمثل خطوط عريضة والدليل الموضعي للهندسة المعمارية : العمارة هي فن وعلم تصميم وتخطيط وتشييد المباني والمنشآت ليغطي
مخطط الاتصال,يقدم المخطط التالي نظرة عامة ودليلاً موضوعيًا إلى موضوع الاتصال : الاتصال هو ظاهرة نعتقد جميعًا أننا نستطيع التعرف عليها
مخطط عن الهندسة,الهندسة هي تخصص علمي وهوالعلم الذي يطبق النظريات العلمية، والطرق الرياضية والدليل التجريبي للتصميم، خلق وتحليل الحلول التكنولوجية بالاعتماد على
مخطط تصنيفي للتصنيع,يمثل الإطار التفصيلي التالي نظرةً عامةً على التصنيع وكذلك دليلاً موضوعيًا له : يشير التصنيع إلى مفهوم استخدام الآلات، الأدوات
بيجر,جهاز المناداة أو بيجر أو `` النداء الألي `` هو جهاز الإلكتروني صغير يسهل حمله ويستخدم لاستقبال الرسائل قصيرة أو
وسائط الإعلام التشاركية,في إشارة إلى تعريف صحافة المواطن، يمكن وصف وسائط الإعلام التشاركية بأنها وسائل الإعلام التي يمكن للجمهور من خلالها لعب
حركة أبدية,الحركة الأبدية أو الآلة الأبدية من المفترض أن تحدث في جهاز أو نظام افتراضي ما بحيث تستمر الحركة بعد بدايتها
فلسفة الذكاء الاصطناعي,هناك العديد من التعريفات للذكاء الاصطناعي ولكن هناك أربعة تعاريف هي الأكثر شهرة وانتشاراً في أوساط المجتمع العلمي والجامعات في
فلسفة التقنية,فلسفة التكنولوجيا، أو فلسفة التقنية، هو حقل فرعي من فروع الفلسفة الذي يدرس طبيعة التكنولوجيا وآثارها الاجتماعية . بدأت النقاشات
أسطوانة فونوغراف,أسطوانة فونوغراف؛ الأسطوانة هي قرص دائري به أخاديد حلزونية مركزية، وهي بأحجام وأشكال مختلفة لتسجيل الأصوات تستمعل على جهاز فونوغراف
لوح بايونير,"لوح بايونير هو زوج من الألواح الذهبية مطلى بأكسيد الألومنيوم وُضعت عام 1972 على مركبة بيونير 10 وبيونير 11 ,"
تدوين صوتي,التدوين الصوتي أو البث الصوتي أو البودكاست ( بثّ جيبي ) ( بالإنجليزية : Podcast ) هو سلسلة وسائط متعددة
محطة البيانات المحمولة,محطة البيانات المحمولة ، أو PDT باختصار ، هو جهاز إلكتروني يستخدم لإدخال البيانات أو استرجاعها عبر الإرسال اللاسلكي (
ورقة الموقف,ورقة الموقف هي مقال يعرض رأيًا ما بشأن إحدى القضايا . ويكون عادةً رأي الكاتب أو جهة أخرى محددة، مثل
بوست سكريبت,لغة الـ بوست سكريبت ( بالإنجليزية : PostScript PS ) هي لغة برمجة ديناميكية متسلسلة ابتكرها جون وورنوك، شارلز جيشكي،
تقنية ما قبل التاريخ,تقنية ما قبل التاريخ هي التقنية التي تسبق التاريخ المسجل، التاريخ هو دراسة الماضي باستخدام سجلات مكتوبة، أي شيء قبل
مؤتمر باجواش للعلوم والشؤون الدولية,مؤتمر باجواش للعلوم والشؤون الدولية ( بالإنجليزية : Pugwash Conferences on Science and World Affairs ) هي منظمة دولية تحاول
أر تي إف إم,RTFM هو تعبير مركب من الأحرف الأولى لجملة `` Read The Fucking Manual ( أقرأ الدليل اللعين ) '' أو
تفاعل البوليميراز المتسلسل اللحظي,تفاعل البوليميراز المتسلسل اللحظي تفاعل البوليميراز المتسلسل اللحظي ( بالإنجليزية : real-time polymerase chain reaction ) ويسمى أيضا تفاعل البوليميراز
تنظيم تقنية النانو,تنظيم تقنية النانو ان مسألة تنظيم مهم جدا بسبب الجدل المستمر بشأن الآثار المترتبة على تقنية النانو، وهناك جدل كبير
مصادر الطاقة المتجددة والتخفيف من آثار التغير المناخي,نشرت اللجنة الدولية للتغيرات المناخية في الأمم المتحدة مقالاً خاصاً بمصادر الطاقة المتجددة والتخفيف من آثار التغير المناخي في 9
طاقة متجددة,الطّاقة المتجددة هي الطّاقة المُستَمّدة من الموارد الطبيعية التي تتجدد أي الّتي لا تنفذ . تختلف جوهريًا عن الوقود الأحفوري
مكرر,في مجال الاتصالات، المكرر ( بالإنجليزية : Repeater ) هو جهاز إلكتروني الذي يتلقى إشارة و يعيد بثها بعد ذلك
تقرير,التقرير هو شكل من أشكال إيصال المعلومات، والتي تكون مصاغة بحيث تكون معدّة بشكل شبه نهائي للوصول إلى المستقبل .
تجوال ( اتصالات ),التجوال في مجال الاتصالات هو التنقل من مكان لآخر بحيث يظل المتنقل متصلا بشبكته الأصلية دون انقطاع، مثلا بأن يتلقى
روبرت إي . هورن,روبرت إي . هورن ( بالإنجليزية : Robert E. Horn ) هو عالم سياسة أمريكي، ولد في 1933 .
اقتصاديات الروبوت,تسعى اقتصاديات الروبوت ( Robot economics ) لإدراك وظيفة وديناميكيات السوق الخاصة بالروبوت . حيث تؤدي الأسواق الخاصة بالروبوت وظيفتها
